{
  "schema_version": "simulated-user-profile/v1",
  "profile_id": "first-time-novice",
  "display_name": "First-Time Novice",
  "archetype": "first-time novice",
  "primary_goal": "Understand the promise quickly and finish the first meaningful task without guidance.",
  "tool_literacy": "low",
  "domain_familiarity": "low",
  "risk_tolerance": "low",
  "workflow_preference": "step-by-step clarity with visible next actions",
  "failure_sensitivity": "high",
  "feedback_style": "balanced",
  "preferred_tasks": [
    "first-run journey",
    "guided onboarding"
  ],
  "notes": "Surface confusion early and treat ambiguity as a blocker candidate."
}
